{
  "schemaVersion": "1.0",
  "repository": "bradlaw76/power-platform-vscode-starter",
  "remote": "origin",
  "branch": "main",
  "capabilities": [
    { "id": "runtime", "title": "Core build runtime", "category": "runtime", "scope": "all", "paths": ["scripts/bootstrap/00-*", "scripts/bootstrap/05-*", "scripts/bootstrap/10-*", "scripts/bootstrap/15-*", "scripts/bootstrap/20-*", "scripts/bootstrap/30-*", "scripts/bootstrap/40-*", "scripts/bootstrap/50-*", "scripts/bootstrap/60-*", "scripts/bootstrap/62-*", "scripts/bootstrap/80-*", "scripts/bootstrap/90-*", "scripts/bootstrap/95-*", "scripts/bootstrap/helpers/dataverse-runtime.ps1", "scripts/bootstrap/helpers/wizard-*", "scripts/bootstrap/*repository-updates.ps1", "scripts/bootstrap/helpers/repository-updates.ps1", "repository-updates.json", "schemas/repository-updates/*"], "guidance": "Review affected stages and run their regression checks; path changes alone do not prove a bug fix." },
    { "id": "semantic-fields", "title": "Semantic field planning", "category": "governance", "scope": "all", "paths": ["*semantic-field*", "*field-type-decisions*", "scripts/bootstrap/30-build-columns.ps1"], "guidance": "Review mandatory planning and metadata gates before the next affected build." },
    { "id": "compatibility", "title": "Runtime contract compatibility", "category": "compatibility-review", "scope": "all", "paths": ["wizard.profile.json", "docs/wizard-contract-v1.md"], "guidance": "Compare contract versions and review migration requirements; do not assume compatibility." },
    { "id": "html-reports", "title": "Requirement-backed HTML reports", "category": "optional-feature", "scope": "selected", "paths": ["*html-report*", "scripts/bootstrap/65-*", "scripts/bootstrap/70-*", "docs/live-report-web-resources-runbook.md"], "guidance": "Review approved report definitions, mappings, supported calculations and placement verification." },
    { "id": "native-reports", "title": "Native charts and dashboards", "category": "optional-feature", "scope": "selected", "paths": ["scripts/bootstrap/08-*", "scripts/bootstrap/64-*", "docs/dataverse-report-wizard.md", "schemas/payloads/reporting.schema.json"], "guidance": "Review chart/dashboard definitions and native reporting selections." },
    { "id": "form-formatting", "title": "Second-pass form formatting", "category": "optional-feature", "scope": "selected", "paths": ["scripts/bootstrap/63-*", "*form-layouts*", "*dataverse-form-formatter*"], "guidance": "Optional: preview wizard-owned Main forms and obtain the required plan-hash approval." },
    { "id": "grid-controls", "title": "Power Apps view grids", "category": "optional-feature", "scope": "selected", "paths": ["scripts/bootstrap/61-*", "*grid-controls*"], "guidance": "Optional: use the maker handoff and verify exported metadata; this is not automatic grid deployment." },
    { "id": "choice-presentations", "title": "Choice presentation", "category": "optional-feature", "scope": "selected", "paths": ["scripts/bootstrap/35-*", "*choice-presentation*"], "guidance": "Optional: preview Choice labels/colors and obtain the required plan-hash approval." },
    { "id": "fast", "title": "FAST planning and readiness", "category": "experimental", "scope": "selected", "paths": ["scripts/accelerators/*", "schemas/accelerators/*", "docs/fast-integration/*", "accelerator.providers.json"], "guidance": "Default-off planning/readiness only. Recommendations never authorize FAST-dependent Apply or deployment." },
    { "id": "documentation", "title": "Guides and authoring instructions", "category": "documentation", "scope": "all", "paths": ["*.md", ".github/skills/*", ".claude/skills/*", ".github/prompts/*"], "guidance": "Review relevant guidance; documentation changes are not deployment instructions or approval." },
    { "id": "quality", "title": "Validation and CI", "category": "validation", "scope": "all", "paths": ["scripts/ci/*", ".github/workflows/*", "run-quality.ps1"], "guidance": "Review validation changes and run the applicable checks before adopting runtime changes." }
  ]
}
